{
  "schema_version": 2,
  "task_id": "resume-application-workflows-v2-integration",
  "title": "Resume/Application Workflows v2 Integration",
  "status": "PLANNED",
  "goal": "Evaluate and explicitly integrate the promoted reusable document-artifact mechanics with the existing PADataset resume/application domain, including a justified decision on whether that private domain should remain in PADataset or migrate to a dedicated repository; do not move it automatically.",
  "execution_topology": "remote_only",
  "workflow": {
    "repository": "workspace-control",
    "path": "workflows/document-artifact-build.v1.json",
    "checkpoint_sha": "0bb8705e7a416bb064f3cd6c877e9d3fe559c8b9",
    "content_sha": "0d66b919acdd2e51c08d2e8496c41dc22aed47c4"
  },
  "parent_execution_owner": "course-workflows-v2-refactor",
  "current_stage": "baseline_recovery",
  "acceptance_criteria": [
    "A fresh executor starts from PADataset README.md at the pinned resume-framework checkpoint and routes only into the resume/application domain.",
    "Candidate/application truth, private values, target-specific evidence, production specs, and submission semantics remain domain-owned rather than copied into workspace-control.",
    "The shared document-artifact lifecycle maps cleanly to source -> deterministic build/render -> structural/static validation -> visual QA -> bounded revision -> delivery gate.",
    "Automated visual QA is accepted when sufficient; a human gate is retained only where the resume/application owner explicitly requires substantive judgment.",
    "The task explicitly evaluates PADataset-vs-dedicated-private-domain ownership before any repository move; no move is automatic.",
    "PADataset research/framework content outside resumes/** is not mutated by this integration.",
    "Any eventual repository move, if justified, is separately authorized and leaves a durable provenance/redirect plan.",
    "The final integration checkpoint is pushed/verified and recoverable without prior conversation."
  ],
  "constraints": [
    "Do not mutate workspace-control shared architecture from this child.",
    "Do not mutate PADataset research, RF dataset, paper, slide, or unrelated application domains outside the authorized resume paths.",
    "Do not create a new repository or move private data merely because separation is conceptually cleaner; require a justified migration decision and explicit authority.",
    "Do not expose private candidate/application values into workspace-control or public artifacts.",
    "Do not submit applications, send messages, or perform external irreversible actions as part of architecture integration.",
    "If resume-framework moves from the pinned checkpoint, refresh this capsule before mutation."
  ],
  "repositories": [
    {
      "name": "workspace-control",
      "intent": "read",
      "base_sha": "0bb8705e7a416bb064f3cd6c877e9d3fe559c8b9",
      "remote": {
        "branch": "main",
        "checkpoint_sha": "0bb8705e7a416bb064f3cd6c877e9d3fe559c8b9",
        "verified": true
      },
      "local": null,
      "allowed_mutation_scope": []
    },
    {
      "name": "PADataset",
      "intent": "mutate",
      "base_sha": "078461795be3c1d3e5c3845c81607166fac9fad3",
      "remote": {
        "branch": "resume-framework",
        "checkpoint_sha": "078461795be3c1d3e5c3845c81607166fac9fad3",
        "verified": true
      },
      "local": null,
      "allowed_mutation_scope": [
        "README.md",
        "workspace-control.lock.json",
        "resumes/**"
      ]
    }
  ],
  "stages": [
    {
      "id": "baseline_recovery",
      "status": "PLANNED",
      "execution_owner": "resume-application-integration",
      "selected_executor": "chatgpt",
      "selected_surface": "github",
      "inputs": [
        "078461795be3c1d3e5c3845c81607166fac9fad3",
        "0bb8705e7a416bb064f3cd6c877e9d3fe559c8b9:document-artifact-build-v1"
      ],
      "outputs": [],
      "validation": [],
      "resume_condition": null
    },
    {
      "id": "domain_separation_evaluation",
      "status": "PLANNED",
      "execution_owner": "resume-application-integration",
      "selected_executor": "chatgpt",
      "selected_surface": "github",
      "inputs": [
        "baseline_recovery"
      ],
      "outputs": [],
      "validation": [],
      "resume_condition": null
    },
    {
      "id": "artifact_workflow_integration",
      "status": "PLANNED",
      "execution_owner": "resume-application-integration",
      "selected_executor": "chatgpt",
      "selected_surface": "github",
      "inputs": [
        "domain_separation_evaluation"
      ],
      "outputs": [],
      "validation": [],
      "resume_condition": null
    },
    {
      "id": "regression_validation",
      "status": "PLANNED",
      "execution_owner": "resume-application-integration",
      "selected_executor": "chatgpt",
      "selected_surface": "github+runtime",
      "inputs": [
        "artifact_workflow_integration"
      ],
      "outputs": [],
      "validation": [],
      "resume_condition": null
    },
    {
      "id": "completion",
      "status": "PLANNED",
      "execution_owner": "resume-application-integration",
      "selected_executor": "chatgpt",
      "selected_surface": "github",
      "inputs": [
        "regression_validation"
      ],
      "outputs": [],
      "validation": [],
      "resume_condition": null
    }
  ],
  "checkpoints": [
    {
      "id": "promoted-shared-workflow",
      "kind": "git_commit",
      "identity": "0bb8705e7a416bb064f3cd6c877e9d3fe559c8b9",
      "required_for_resume": true,
      "evidence": [
        "workflow workflows/document-artifact-build.v1.json blob 0d66b919acdd2e51c08d2e8496c41dc22aed47c4"
      ]
    },
    {
      "id": "target-starting-checkpoint",
      "kind": "git_commit",
      "identity": "078461795be3c1d3e5c3845c81607166fac9fad3",
      "required_for_resume": true,
      "evidence": [
        "PADataset resume-framework verified at child creation"
      ]
    }
  ],
  "artifacts": [],
  "validation": [
    {
      "check": "Child capsule creation baseline",
      "result": "PASS",
      "evidence": [
        "Promoted shared workflow identity pinned at 0bb8705e7a416bb064f3cd6c877e9d3fe559c8b9/workflows/document-artifact-build.v1.json/0d66b919acdd2e51c08d2e8496c41dc22aed47c4.",
        "Target repository branch resume-framework verified at exact starting checkpoint 078461795be3c1d3e5c3845c81607166fac9fad3.",
        "No child-repository mutation was performed by the parent task."
      ]
    }
  ],
  "blockers": [],
  "remaining_work": [
    "Recover the PADataset resume/application route and existing builder/QA owners.",
    "Evaluate whether domain separation from PADataset is justified and record the decision.",
    "Integrate the promoted document-artifact mechanics without changing candidate truth.",
    "Run cold-start/build/render/semantic+visual-QA/bounded-revision regressions.",
    "Checkpoint and verify the resulting integration state."
  ],
  "next_safe_action": "Start only from PADataset README.md at 078461795be3c1d3e5c3845c81607166fac9fad3 on branch resume-framework, then follow the documented resume/application route to the smallest required owning contexts. Compare the existing resume production lifecycle to workspace-control document-artifact-build at 0bb8705e7a416bb064f3cd6c877e9d3fe559c8b9. First decide, from repository evidence, whether the domain should remain in PADataset or warrants a separate private repository; do not move or create a repository automatically. If the target branch moved from 078461795be3c1d3e5c3845c81607166fac9fad3, refresh this capsule before mutation.",
  "notes": "This child owns resume/application integration only. It does not own PADataset research migration."
}
