{
  "schema_version": 2,
  "task_id": "workspace-evidence-first-solution-research-v1",
  "title": "Workspace Evidence-First Solution Research v1",
  "status": "IN_PROGRESS",
  "goal": "Promote a reusable workspace-level research-before-implementation workflow that lets any project/chat investigate comparable problems, current literature, open-source implementations, practitioner patterns, and candidate architectures before committing to a material implementation direction.",
  "execution_topology": "remote_only",
  "workflow": null,
  "parent_execution_owner": "research-engine-local-extract-redesign-v1",
  "current_stage": "workflow_design_and_promotion",
  "acceptance_criteria": [
    "A workspace-control-owned procedure defines when evidence-first solution research should trigger and when it should not.",
    "A reusable workflow descriptor separates problem framing, prior-work/exclusion recovery, external research, architecture synthesis, candidate narrowing, benchmark planning, and implementation handoff.",
    "The workflow requires current external evidence for materially uncertain architecture/model/library choices instead of defaulting to implementation-first trial-and-error.",
    "Project/domain truth remains owned by the project repository; workspace-control owns only the reusable research/decision mechanics.",
    "The workflow explicitly reuses known-good implementations and excludes previously failed approaches unless new evidence changes the failed premise.",
    "The workflow produces a bounded shortlist and measurable implementation/benchmark hypotheses before heavyweight downloads, expensive runtime work, or broad implementation begins.",
    "The workflow supports web, scholarly, repository, file, and connected-source evidence without depending on one specific executor/tool vendor.",
    "The workflow is discoverable from the normal workspace-control root route so future chats can invoke it.",
    "The descriptor and procedure pass workspace-control full integration/contract validation.",
    "The originating EXTRACT redesign task can pin the exact durable workflow identity after promotion."
  ],
  "constraints": [
    "Do not move project-specific scientific or implementation truth into workspace-control.",
    "Do not require external research for trivial, deterministic, or already-specified implementation work.",
    "Do not treat popularity, benchmark marketing, or one source as sufficient architectural evidence.",
    "Research is a decision stage, not permission for uncontrolled scope expansion; the owning task still defines what may be changed.",
    "Separate current evidence from historical failed approaches and from project-specific constraints.",
    "Do not download/install heavyweight candidates merely because they appear promising in the research survey.",
    "Preserve executor portability: the workflow may name capability classes but not require one specific chat model or connector.",
    "Keep the current accepted research-engine VERIFY implementation and production checkpoint unchanged while this workspace workflow is promoted."
  ],
  "repositories": [
    {
      "name": "workspace-control",
      "intent": "mutate",
      "base_sha": "aa24d3f25a54745bcffb607f9ff43310181c9b85",
      "remote": {
        "branch": "main",
        "checkpoint_sha": "aa24d3f25a54745bcffb607f9ff43310181c9b85",
        "verified": true
      },
      "local": null,
      "allowed_mutation_scope": [
        "tasks/active/workspace-evidence-first-solution-research-v1.json",
        "tasks/active/workspace-evidence-first-solution-research-v1.md",
        "procedures/evidence_first_solution_research.md",
        "workflows/evidence-first-solution-research.v1.json",
        "README.md",
        "tests/**"
      ]
    }
  ],
  "stages": [
    {
      "id": "workflow_design_and_promotion",
      "status": "IN_PROGRESS",
      "execution_owner": "chatgpt",
      "selected_executor": "chatgpt",
      "selected_surface": "github",
      "inputs": [
        "observed research-engine EXTRACT redesign where external solution research materially changed the architecture",
        "workspace-control workflow descriptor and operator contracts",
        "existing reusable workflow conventions"
      ],
      "outputs": [
        "procedures/evidence_first_solution_research.md",
        "workflows/evidence-first-solution-research.v1.json",
        "README.md root-route discoverability update",
        "tests/test_evidence_first_solution_research.py",
        "workspace-control PR #70"
      ],
      "validation": [
        {
          "check": "Workspace-level ownership classification",
          "result": "PASS",
          "evidence": [
            "The method governs cross-project decision mechanics rather than research-engine scientific truth.",
            "workspace-control is registered as owner of cross-project operating policy and reusable coordination tooling.",
            "The originating research-engine child task retains all EXTRACT-specific architecture and benchmark truth."
          ]
        },
        {
          "check": "Implementation checkpoint",
          "result": "PASS",
          "evidence": [
            "workspace-control branch evidence-first-solution-research-v1 is exactly four intended files ahead of PR base: procedure, workflow descriptor, README routing, and focused regression test.",
            "PR #70 head is 4600dcd0f77a1e707e60d812e82fe7e2ef08c601.",
            "Validation profile classifies procedures/workflows as FULL_INTEGRATION; run 37369399893 is queued."
          ]
        }
      ],
      "resume_condition": "Reusable workflow is durable, discoverable, validated, and can be pinned by project tasks."
    }
  ],
  "checkpoints": [
    {
      "id": "originating-use-case",
      "kind": "recovery_restore_point",
      "identity": "4600dcd0f77a1e707e60d812e82fe7e2ef08c601",
      "required_for_resume": true,
      "evidence": [
        "origin=research-engine-local-extract-redesign-v1",
        "shared method implementation complete on branch evidence-first-solution-research-v1",
        "PR #70 head=4600dcd0f77a1e707e60d812e82fe7e2ef08c601",
        "CI=Workspace Control Validation run 37369399893 queued",
        "next safe action=if CI passes, merge PR #70, verify canonical main, record exact workflow binding, then return to originating EXTRACT task"
      ]
    }
  ],
  "artifacts": [],
  "validation": [
    {
      "check": "Explicit user authorization",
      "result": "PASS",
      "evidence": [
        "User explicitly requested promoting the research method into workspace-control for reuse across chats.",
        "User requested consolidation into a plan and continuation into implementation."
      ]
    }
  ],
  "blockers": [
    "Workspace Control Validation run 37369399893 is queued for PR #70; no additional workflow mutation is justified unless validation fails."
  ],
  "remaining_work": [
    "Wait for full-integration validation of PR #70.",
    "If validation passes, merge PR #70 and verify canonical workspace-control main.",
    "Record the exact durable workflow identity for workflows/evidence-first-solution-research.v1.json.",
    "Return that identity to research-engine-local-extract-redesign-v1 so the originating task can formally bind the reusable workflow."
  ],
  "next_safe_action": "Wait for workspace-control PR #70 validation run 37369399893. If it passes, merge PR #70 without additional scope expansion, verify the canonical main commit and merged workflow contents, then checkpoint this task as COMPLETE/CHECKPOINTED-equivalent and return the exact workflow identity to `research-engine-local-extract-redesign-v1`. If CI fails, diagnose only the demonstrated validation defect.",
  "last_executor": "chatgpt",
  "last_surface": "github"
}
